product_name,product_url,website_name,original_category,product_image,product_image_type,product_image_name,product_code,product_description,product_unit_price,product_currency,product_discount_percentage,product_total_orders,product_stock_quantity,product_total_ratings,product_overall_stars
Earl Grey Cloud,https://tljus.com/menus/cakes/earl-grey-cloud,tljus,cakes,https://cdn.prod.website-files.com/649249d29a20bd6bc3deac48/6581e6d668e2a79cbb8f4f1f_Earl%20Grey%20Cloud.png,1,,,,0,₫,0.0,0,50,0,0.0
Blueberry Yogurt #3,https://tljus.com/menus/cakes/blueberry-yogurt-3,tljus,cakes,https://cdn.prod.website-files.com/649249d29a20bd6bc3deac48/6581e69407c4c2d74c57e7ae_Blueberry(3,1,,,,0,₫,0.0,0,50,0,0.0
Blueberry Yogurt #2,https://tljus.com/menus/cakes/blueberry-yogurt-2,tljus,cakes,https://cdn.prod.website-files.com/649249d29a20bd6bc3deac48/6581e674702c5050db738730_Blueberry(2,1,,,,0,₫,0.0,0,50,0,0.0
Strawberry Lychee,https://tljus.com/menus/cakes/strawberry-lychee,tljus,cakes,https://cdn.prod.website-files.com/649249d29a20bd6bc3deac48/6581e5aef5c94a91c721ab19_StrawberryLychee.png,1,,,,0,₫,0.0,0,50,0,0.0
Strawberry Gateau,https://tljus.com/menus/cakes/strawberry-gateau,tljus,cakes,https://cdn.prod.website-files.com/649249d29a20bd6bc3deac48/6581e567f5c3924368a84e44_Strawberry%20Gateau.png,1,,,,0,₫,0.0,0,50,0,0.0
Cloud Cake #3,https://tljus.com/menus/cakes/cloud-cake-3,tljus,cakes,https://cdn.prod.website-files.com/649249d29a20bd6bc3deac48/649249d29a20bd6bc3deade9_Screenshot%202023-05-15%20at%2012.12.18%20PM.png,1,,,"Cloud cream[heavy cream(milk), whipped cream, sugar],
White cake sheet(whole egg, wheat flour, sugar, egg white,
milk, corn syrup, shortening, margarine, emulsifying agent,
corn starch, baking powder, salt, citric acid, xanthan gum),
Strawberry, Simple syrup(water, sugar, lemon juice), Green
grapes, Red grapes, Blackberry, Blueberry, Raspberry, Glaze,
Chocolate sign board(dark)",0,₫,0.0,0,50,0,0.0
Cloud Cake #2,https://tljus.com/menus/cakes/cloud-cake-2,tljus,cakes,https://cdn.prod.website-files.com/649249d29a20bd6bc3deac48/649249d29a20bd6bc3deade8_Screenshot%202023-05-15%20at%2011.57.36%20AM.png,1,,,"Cloud cream[heavy cream(milk), whipped cream, sugar],
White cake sheet(whole egg, wheat flour, sugar, egg white,
milk, corn syrup, shortening, margarine, emulsifying agent,
corn starch, baking powder, salt, citric acid, xanthan gum),
Strawberry, Red grapes, Simple syrup(water, sugar, lemon
juice), Blackberry, Blueberry, Raspberry, Glaze",0,₫,0.0,0,50,0,0.0
Strawberry Cloud Cake,https://tljus.com/menus/cakes/strawberry-cloud-cake,tljus,cakes,https://cdn.prod.website-files.com/649249d29a20bd6bc3deac48/649249d29a20bd6bc3deade6_Strawberry%20Cloud%20Cake.webp,1,,,"Strawberry cloud cream(heavy cream, whipping cream, sugar, strawberry syrup), Strawberry cake sheet[liquid egg, sugar, wheat flour, butter, strawberry syrup, strawberry powder, emulsifying agent, baking powder, sea salt, food coloring(pink)], Strawberry, Simple syrup (water, sugar, lemon), Red grape, Blueberry, Decorative chocolate, Glaze",0,₫,0.0,0,50,0,0.0
Green Tea Cloud Cake,https://tljus.com/menus/cakes/green-tea-cloud-cake,tljus,cakes,https://cdn.prod.website-files.com/649249d29a20bd6bc3deac48/649249d29a20bd6bc3deade5_Green%20Tea%20Cloud%20Cake.webp,1,,,"Green tea cake sheet(liquid egg, sugar, wheat flour, butter, green tea powder, emulsifying agent, baking powder, sea salt, food color), Cloud cream[heavy cream(milk), whipping cream, sugar], Strawberry, Simple syrup (water, sugar, lemon), Green tea sheet crumb, Blackberry, Green grape, Raspberry, Blueberry, Glaze",0,₫,0.0,0,50,0,0.0
Peach Cream Cake,https://tljus.com/menus/cakes/peach-cream-cake,tljus,cakes,https://cdn.prod.website-files.com/649249d29a20bd6bc3deac48/649249d29a20bd6bc3deade4_Peach%20Cream%20Cake.webp,1,,,"Cream, Whole egg, Whipping cream, Apricot jam, Sugar, Frozen peach, White chocolate, Wheat flour, Water, Milk, Coating chocolate, Yogurt powder, Corn syrup, Shortening, Margarine, Cheese, Emulsifying agent, Corn starch, Baking powder, Peach flavored syrup, Salt, Cake stabilizer, Citric acid, Xanthan gum, Sugar powder",0,₫,0.0,0,50,0,0.0
Triple Berry Cloud,https://tljus.com/menus/cakes/triple-berry-cloud,tljus,cakes,https://cdn.prod.website-files.com/649249d29a20bd6bc3deac48/649249d29a20bd6bc3deae28_Screenshot%202023-05-17%20at%203.52.39%20PM.png,1,,,"Cloud cream (heavy cream, whipped cream, sugar), White cake sheet (whole egg, wheat flour, sugar, egg white, milk, corn syrup, shortening, margarine, emulsifying agent, corn starch, baking powder, salt, citric acid, xanthan gum), Strawberry, Strawberry cloud cream (heavy cream, whipped cream, sugar, strawberry syrup), Cake syrup (water, sugar), Raspberry, Blueberry, Glaze",0,₫,0.0,0,50,0,0.0
Mango Cloud #3,https://tljus.com/menus/cakes/mango-cloud-3,tljus,cakes,https://cdn.prod.website-files.com/649249d29a20bd6bc3deac48/649249d29a20bd6bc3deade3_Mango%20Cloud%203.webp,1,,,"Mango cream[heavy cream(milk), mango puree, whipped cream, sugar, mango compound], White cake sheet(whole egg, wheat flour, sugar, egg white, milk, corn syrup, shortening, margarine, emulsifying agent, corn starch, baking powder, salt, citric acid, xanthan gum), Mango, Blueberry, Cloud cream[heavy cream(milk), whipped cream, sugar], Simple syrup(water, sugar, lemon juice), Mango glaze(Mango compound, water, sugar, lemon juice), Glaze",0,₫,0.0,0,50,0,0.0
Mango Cloud #2,https://tljus.com/menus/cakes/mango-cloud-2,tljus,cakes,https://cdn.prod.website-files.com/649249d29a20bd6bc3deac48/649249d29a20bd6bc3deade2_Mango%20Cloud%202.webp,1,,,"Mango cream[heavy cream(milk), mango puree, whipped cream, sugar, mango compound], White cake sheet(whole egg, wheat flour, sugar, egg white, milk, corn syrup, shortening, margarine, emulsifying agent, corn starch, baking powder, salt, citric acid, xanthan gum), Mango, Blueberry, Cloud cream[heavy cream(milk), whipped cream, sugar], Simple syrup(water, sugar, lemon juice), Glaze",0,₫,0.0,0,50,0,0.0
Mocha Cloud,https://tljus.com/menus/cakes/mocha-cloud,tljus,cakes,https://cdn.prod.website-files.com/649249d29a20bd6bc3deac48/649249d29a20bd6bc3deade1_Screenshot%202023-05-02%20at%209.35.30%20AM.webp,1,,,"Mocha cloud cream[heavy cream(milk), coffee extract, whipped cream, sugar], Mocha cake sheet(liquid egg, sugar, wheat flour, butter, emulsifying agent, coffee extract, baking powder, sea salt), Strawberry, Cloud cream[heavy cream(milk), whipped cream, sugar], Cake syrup(water, sugar), Caramel sauce, Green grape, Raspberry, Blueberry, Glaze",0,₫,0.0,0,50,0,0.0
Choco Cloud,https://tljus.com/menus/cakes/choco-cloud,tljus,cakes,https://cdn.prod.website-files.com/649249d29a20bd6bc3deac48/649249d29a20bd6bc3deade0_Screenshot%202023-05-02%20at%209.25.22%20AM.webp,1,,,"Cloud cream[heavy cream(milk), whipping cream, sugar], Choco cake sheet(liquid egg, sugar, wheat flour, butter, dark cocoa powder, dough improver, baking powder, sea salt), Semisweet chocolate, Strawberry, Simple syrup (water, sugar, lemon), Cocoa powder, Semisweet chocolate",0,₫,0.0,0,50,0,0.0
Heart Chocolate Cake,https://tljus.com/menus/cakes/heart-chocolate-cake,tljus,cakes,https://cdn.prod.website-files.com/649249d29a20bd6bc3deac48/649249d29a20bd6bc3deadee_Screenshot%202023-05-15%20at%2012.23.43%20PM.png,1,,,"Whole egg, Sugar, Margarine, Wheat flour, Chocolate filling, Milk chocolate, Prepared edible fat, Egg white, Shortening, Soybean oil, Chocolate powder, Cocoa powder, Decorative chocolate(dark), Margarine, Decorative chocolate(dark, white), Emulsifying agent, Chocolate signboard(dark), Decorative chocolate(dark), Salt",0,₫,0.0,0,50,0,0.0
Red Velvet Cake,https://tljus.com/menus/cakes/red-velvet-cake,tljus,cakes,https://cdn.prod.website-files.com/649249d29a20bd6bc3deac48/649249d29a20bd6bc3deaded_Screenshot%202023-05-15%20at%2012.22.11%20PM.png,1,,,"Red velvet cake sheet (red velvet cake mix, water, egg white, corn oil, sugar), Cream cheese, Fondant, Sugar, Butter",0,₫,0.0,0,50,0,0.0
Classic Mocha Cake,https://tljus.com/menus/cakes/classic-mocha-cake,tljus,cakes,https://cdn.prod.website-files.com/649249d29a20bd6bc3deac48/649249d29a20bd6bc3deadeb_Screenshot%202023-05-15%20at%2012.15.49%20PM.png,1,,,"Whole Egg, Sugar, Margarine1, Wheat flour, Glaze, Water, Prepared edible fat, Shortening, Margarine2, Caramel nut crunch, Coffee extract, Chocolate decoration(milk), Emulsifying agent, Chocolate decoration(dark), Dry roasted almond, Hazelnut, Baking powder, Espresso flavor, Chocolate signboard(dark), Chocolate decoration(milk), Pistachio, Rum, Caramel flavor, Coffee powder",0,₫,0.0,0,50,0,0.0
Strawberry Sweet,https://tljus.com/menus/cakes/strawberry-sweet,tljus,cakes,https://cdn.prod.website-files.com/649249d29a20bd6bc3deac48/649249d29a20bd6bc3deadea_Screenshot%202023-05-15%20at%2012.14.16%20PM.png,1,,,"Strawberry cake sheet[liquid egg, sugar, wheat flour, butter,
strawberry syrup, strawberry powder, emulsifying agent, baking powder,
sea salt, food coloring(pink)], Butter, Margareine, Butter cream, Sugar,
Water, Strawberry preserve, Strawberry crunch, Strawberry flavor paste,
Lemon juice, Corn syrup, Food coloring(pink), Gold leaf",0,₫,0.0,0,50,0,0.0
Cheesecake,https://tljus.com/menus/cakes/cheesecake,tljus,cakes,https://cdn.prod.website-files.com/649249d29a20bd6bc3deac48/649249d29a20bd6bc3deadf0_Screenshot%202023-05-15%20at%2012.26.57%20PM.png,1,,,"Cheese cake base[cream cheese, sugar, soboro crunch topping{wheat flour. margarine, sugar, wheat flour, corn starch, glucose(corn starch), oligosaccharide, egg, skimmed milk powder(milk), baking powder}, whipping cream, greek yogurt, prepared edible fat(butter), whole egg, vanilla extract], Glaze",0,₫,0.0,0,50,0,0.0
Tiramisu,https://tljus.com/menus/cakes/tiramisu,tljus,cakes,https://cdn.prod.website-files.com/649249d29a20bd6bc3deac48/649249d29a20bd6bc3deadf1_Screenshot%202023-05-15%20at%2012.29.13%20PM.png,1,,,"Cake base[milk, cream, sugar, cream cheese, water, whole egg, cheese, egg yolk, wheat flour, mascarpone cheese, shortening, margarine, coffee powder, coffee extract, gelatin(pork), emulsifying agent, coffee extract, baking powder, espresso flavor, caramel flavor], Cocoa powder, Sugar powder",0,₫,0.0,0,50,0,0.0
Sweet Potato Mousse Cake,https://tljus.com/menus/cakes/sweet-potato-mousse-cake,tljus,cakes,https://cdn.prod.website-files.com/649249d29a20bd6bc3deac48/649249d29a20bd6bc3deadf2_Screenshot%202023-05-15%20at%2012.30.52%20PM.png,1,,,"Sweet potato mousse base(sweet potato filling, milk cream, whole egg, sugar, water, sweet potato paste, wheat flour, egg white, milk, corn syrup, shortening, margarine, emulsifying agent, gelatin(pork), corn starch, baking powder, salt, citric acid, xanthan gum), Cloud cream[heavy cream(milk), whipping cream, sugar], White cake sheet(whole egg, wheat flour, sugar, egg white, milk, corn syrup, shortening, margarine, emulsifying agent, corn starch, baking powder, salt, citric acid, xanthan gum), Sliced sweet potato, Corn oil, Chocolate sign board(dark)",0,₫,0.0,0,50,0,0.0
Triple Chocolate Mousse Cake,https://tljus.com/menus/cakes/triple-chocolate-mousse-cake,tljus,cakes,https://cdn.prod.website-files.com/649249d29a20bd6bc3deac48/649249d29a20bd6bc3deadef_Screenshot%202023-05-15%20at%2012.25.34%20PM.png,1,,,"Mousse cake base[milk cream, dark chocolate, sugar, milk, white chocolate, milk chocolate, water, whole egg, wheat flour, egg yolk, egg white, shortening, soybean oil, cocoa powder, gelatin(pork), margarine, vanilla extract, emulsifying agent, salt, cocoa powder, baking soda, baking powder], Ganache filling, Decorative chocolate(white), Cocoa powder, Powdered sugar, Chocolate signboard(dark)",0,₫,0.0,0,50,0,0.0
Vanilla Chocolate Heart Mousse Cake,https://tljus.com/menus/cakes/vanilla-chocolate-heart-mousse-cake,tljus,cakes,https://cdn.prod.website-files.com/649249d29a20bd6bc3deac48/649249d29a20bd6bc3deadf3_Screenshot%202023-05-15%20at%2012.33.43%20PM.png,1,,,"Vanilla chocolate mousse base(milk cream, sugar, whole egg, wheat flour, egg yolk, water, milk, egg white, dark chocolate, milk chocolate, shortening, margarine, corn syrup, emulsifying agent, soybean oil, cocoa powder, vanilla paste, corn starch, gelatin, salt, baking powder, cocoa powder, baking soda, citric acid, xanthan gum), Cloud cream[heavy cream(milk), whipping cream, sugar], Vanilla macaron, Raspberries, Sugar powder",0,₫,0.0,0,50,0,0.0
Strawberry Tiramisu,https://tljus.com/menus/cakes/strawberry-tiramisu,tljus,cakes,https://cdn.prod.website-files.com/649249d29a20bd6bc3deac48/6581e6fd48eaac1b0d837d9d_StrawberryTiramisu.png,1,,,,0,₫,0.0,0,50,0,0.0
Piggy Cake,https://tljus.com/menus/cakes/piggy-cake,tljus,cakes,https://cdn.prod.website-files.com/649249d29a20bd6bc3deac48/649249d29a20bd6bc3deae04_Screenshot%202023-05-15%20at%202.33.25%20PM.png,1,,,"Strawberry butter cream(butter, margarine, sugar, water, strawberry flavor paste, corn syrup), Red velvet cake sheet(red velvet cake mix, water, egg white, corn oil, sugar), White cake sheet(liquid egg, sugar, wheat flour, butter, dough improver, baking powder, sea salt), Raspberry jam mix(raspberry jam, water, sugar, lemon juice), Coconut fine shred, Chocolate decoration(milk), Chocolate decoration(white), Cake syrup(water, sugar, lemon juice), Chocolate decoration(white)",0,₫,0.0,0,50,0,0.0
Party Bear,https://tljus.com/menus/cakes/party-bear,tljus,cakes,https://cdn.prod.website-files.com/649249d29a20bd6bc3deac48/649249d29a20bd6bc3deae03_Screenshot%202023-05-15%20at%202.30.45%20PM.png,1,,,"Whole egg, Sugar, Wheat flour, Coating chocolate, Margarine, Chocolate filling, Water, Shortening. Prepared edible fat, Whipping cream, Dark chocolate, Cocoa powder, Margarine, Decorative chocolate1, Emulsifying agent, Sunflower seed oil, Decorative chocolate2, Decorative chocolate3, Dark chocolate, Baking powder, Corn syrup, Rum",0,₫,0.0,0,50,0,0.0
Jungle Party,https://tljus.com/menus/cakes/jungle-party,tljus,cakes,https://cdn.prod.website-files.com/649249d29a20bd6bc3deac48/649249d29a20bd6bc3deae02_Screenshot%202023-05-15%20at%202.28.40%20PM.png,1,,,"Whole egg, Sugar, Margarine, Wheat flour, Chocolate filling, Water, Prepared edible fat, Egg white, Shortening, Chocolate powder, Soybean oil, Chocolate decoration(dark, milk), Cocoa powder, Brownie bites, Margarine, Emulsifying agent, Chocolate signboard(dark), Salt, Cocoa powder, Rum, Baking soda, Choco crunch cookie, Baking powder",0,₫,0.0,0,50,0,0.0
Peach Cream Piece,https://tljus.com/menus/cakes/peach-cream-piece,tljus,cakes,https://cdn.prod.website-files.com/649249d29a20bd6bc3deac48/649249d29a20bd6bc3deadf4_Copy%20of%20Peach%20Cream%20Piece.png,1,,,"Cream, Whole egg, Whipping cream, Apricot jam, Sugar, Frozen peach, White chocolate, Wheat flour, Water, Milk, Coating chocolate, Yogurt powder, Corn syrup, Shortening, Margarine, Cheese, Emulsifying agent, Corn starch, Baking powder, Peach flavored syrup, Salt, Cake stabilizer, Citric acid, Xanthan gum, Sugar powder",0,₫,0.0,0,50,0,0.0
Orange Cream Piece,https://tljus.com/menus/cakes/orange-cream-piece,tljus,cakes,https://cdn.prod.website-files.com/649249d29a20bd6bc3deac48/649249d29a20bd6bc3deadf5_Copy%20of%20Orange%20Cream%20Piece.png,1,,,,0,₫,0.0,0,50,0,0.0
Blueberry Yogurt Piece Cake,https://tljus.com/menus/cakes/blueberry-yogurt-piece-cake,tljus,cakes,https://cdn.prod.website-files.com/649249d29a20bd6bc3deac48/649249d29a20bd6bc3deadf6_Copy%20of%20Blueberry%20Yogurt%20Piece%20Cake.png,1,,,"Yogurt cloud cream[heavy cream(milk), whipped cream, yogurt powder, sugar], White cake sheet(liquid egg, sugar, wheat flour, butter, emulsifying agent, baking powder, sea salt), Blueberry, Blueberry filling, Cake syrup(water, sugar), Glaze, Chocolate sign board(dark)",0,₫,0.0,0,50,0,0.0
Cloud Piece Cake,https://tljus.com/menus/cakes/cloud-piece-cake,tljus,cakes,https://cdn.prod.website-files.com/649249d29a20bd6bc3deac48/649249d29a20bd6bc3deadf7_Copy%20of%20Cloud%20Cake%20Piece.png,1,,,"Cloud cream[heavy cream(milk), whipped cream, sugar], White cake sheet(liquid egg, sugar, wheat flour, butter, emulsifying agent, baking powder, sea salt), Strawberry, Raspberry, Cake syrup(water, sugar), Blueberry, Glaze, Chocolate sign board(dark)",0,₫,0.0,0,50,0,0.0
Chocolate Cloud Piece Cake,https://tljus.com/menus/cakes/chocolate-cloud-piece-cake,tljus,cakes,https://cdn.prod.website-files.com/649249d29a20bd6bc3deac48/649249d29a20bd6bc3deadf8_Copy%20of%20Chocolate%20Cloud%20Piece%20Cake.png,1,,,"Cloud cream[heavy cream(milk), whipping cream, sugar], Choco cake sheet(liquid egg, sugar, wheat flour, butter, dark cocoa powder, dough improver, baking powder, sea salt), Strawberry, Semisweet chocolate, Simple syrup (water, sugar, lemon juice), Chocolate signboard(dark), Glaze, Cocoa powder",0,₫,0.0,0,50,0,0.0
Guava Danish,https://tljus.com/pastries-and-pies/guava-danish,tljus,pastries-and-pies,https://cdn.prod.website-files.com/649249d29a20bd6bc3deac48/658227ba5f7dd4ab02fd014d_IMG_2810.JPG,1,,,,0,₫,0.0,0,50,0,0.0
Caramel Apple Pie,https://tljus.com/pastries-and-pies/caramel-apple-pie,tljus,pastries-and-pies,https://cdn.prod.website-files.com/649249d29a20bd6bc3deac48/65eba263dbaa9daa1a28dc06_Caremel%20Apple%20Pie%201.png,1,,,"Bread dough(wheat flour, apple pie filling, prepared edible fat, water, caramel, sugar, mixed skim milk powder, sea salt), Egg yolk. Glaze",0,₫,0.0,0,50,0,0.0
Almond Croissant,https://tljus.com/pastries-and-pies/almond-croissant,tljus,pastries-and-pies,https://cdn.prod.website-files.com/649249d29a20bd6bc3deac48/65eba27412918256d9f32782_Almond%20Croissant%201.png,1,,,"Croissant[wheat flour, butter, water, sugar, yeast, whole milk powder, eggs, salt, wheat gluten, food enzymes, ascorbic acid], Almond cream[whole egg, margarine, sugar, almond powder, wheat flour, salt], Sliced almond, Sugar powder",0,₫,0.0,0,50,0,0.0
Fruit Pastry,https://tljus.com/pastries-and-pies/fruit-pastry,tljus,pastries-and-pies,https://cdn.prod.website-files.com/649249d29a20bd6bc3deac48/65eba34ecb207a58187ced85_Fruit%20Pastry%201.jpg,1,,,"Pastry dough(wheat flour, butter, water, sugar, yeast, whole egg, sea salt, dough improver, mixed skim milk powder, yeast food), Cloud cream[heavy cream(milk), whipped cream, sugar], Parisian cream, Strawberry, Blueberry, Green grapes, Raspberry, Red grapes, Egg wash(egg, water), Glaze, Sugar powder",0,₫,0.0,0,50,0,0.0
Pain Au Chocolat,https://tljus.com/pastries-and-pies/pain-au-chocolat,tljus,pastries-and-pies,https://cdn.prod.website-files.com/649249d29a20bd6bc3deac48/65eba303f345879eacf3aaf1_Pain%20Au%20Chocolat%201.jpg,1,,,"Wheat flour, Butter, Water, Chocolate, Sugar, Yeast, Whole milk powder, Wheat gluten, Salt, Food enzymes, Ascorbic acid, Egg wash(egg, water)",0,₫,0.0,0,50,0,0.0
Strawberry Croissant,https://tljus.com/pastries-and-pies/strawberry-croissant,tljus,pastries-and-pies,https://cdn.prod.website-files.com/649249d29a20bd6bc3deac48/65eba35e870c693d70e06744_Strawberry%20Croissant%201.png,1,,,"Croissant[wheat flour, butter, water, sugar, yeast, whole milk powder, eggs, salt, wheat gluten, food enzymes, ascorbic acid], Fresh strawberries, Cloud cream[heavy cream(milk), whipped cream, sugar], Sugar powder",0,₫,0.0,0,50,0,0.0
Croissant,https://tljus.com/pastries-and-pies/croissant,tljus,pastries-and-pies,https://cdn.prod.website-files.com/649249d29a20bd6bc3deac48/649249d29a20bd6bc3deadb6_Croissant.webp,1,,,"Croissant[wheat flour, butter, water, sugar, yeast, whole milk powder, eggs, salt, wheat gluten, food enzymes, ascorbic acid]",0,₫,0.0,0,50,0,0.0
Yuzu Pie,https://tljus.com/pastries-and-pies/yuzu-pie,tljus,pastries-and-pies,https://cdn.prod.website-files.com/649249d29a20bd6bc3deac48/649249d29a20bd6bc3deadb5_Yuzu%20Pie.webp,1,,,"Yuzu pie dough(wheat flour, prepared edible fat, milk, sugar, egg yolk, prepared edible fat, corn starch, wheat flour, water, citron jam, sugar, mixed skim milk powder, sea salt), Sugar",0,₫,0.0,0,50,0,0.0
Chocolate Croissant,https://tljus.com/pastries-and-pies/chocolate-croissant,tljus,pastries-and-pies,https://cdn.prod.website-files.com/649249d29a20bd6bc3deac48/649249d29a20bd6bc3deadb4_Chocolate%20Croissant.webp,1,,,"Croissant[wheat flour, butter, water, sugar, yeast, whole milk powder, eggs, salt, wheat gluten, food enzymes, ascorbic acid], Coating chocolate(dark), Sliced almond",0,₫,0.0,0,50,0,0.0
Spinach Feta Danish,https://tljus.com/pastries-and-pies/spinach-feta-danish,tljus,pastries-and-pies,https://cdn.prod.website-files.com/649249d29a20bd6bc3deac48/65eba37bb75ba180e6e0feed_Spinach%20Feta%20Danish%201.png,1,,,"Unbleached enriched flour, Spinach and feta filling, Butter,
Water, Sugar, Yeast, Liquid whole eggs, Salt, Wheat gluten,
Food enzymes(xylanase, amylase), Ascorbic acid, Dried
whole eggs, Skim milk powder, Soy flour",0,₫,0.0,0,50,0,0.0
Garlic & Cheese Croissant,https://tljus.com/pastries-and-pies/garlic-cheese-croissant,tljus,pastries-and-pies,https://cdn.prod.website-files.com/649249d29a20bd6bc3deac48/649249d29a20bd6bc3deae23_Garlic%20%26%20Cheese%20Croissant.jpg,1,,,,0,₫,0.0,0,50,0,0.0
Apple Jam Mont Blanc Pastry,https://tljus.com/pastries-and-pies/apple-jam-mont-blanc-pastry,tljus,pastries-and-pies,https://cdn.prod.website-files.com/649249d29a20bd6bc3deac48/649249d29a20bd6bc3deae27_Apple%20Jam%20Mont%20Blanc%20Pastry.jpg,1,,,,0,₫,0.0,0,50,0,0.0
Vanilla Cream Donut,https://tljus.com/donuts/vanilla-cream-donut,tljus,donuts,https://cdn.prod.website-files.com/649249d29a20bd6bc3deac48/6581ecd1a06966100dd1e38d_IMG_2790.JPG,1,,,,0,₫,0.0,0,50,0,0.0
Chocolate Cream Donut,https://tljus.com/donuts/chocolate-cream-donut,tljus,donuts,https://cdn.prod.website-files.com/649249d29a20bd6bc3deac48/6581ecbf2af10e91b25bd932_IMG_2783.JPG,1,,,,0,₫,0.0,0,50,0,0.0
Mango Cream Donut,https://tljus.com/donuts/mango-cream-donut,tljus,donuts,https://cdn.prod.website-files.com/649249d29a20bd6bc3deac48/6581ecaf57a209c24e4cdccc_IMG_2789.JPG,1,,,,0,₫,0.0,0,50,0,0.0
Croquette,https://tljus.com/donuts/croquette,tljus,donuts,https://cdn.prod.website-files.com/649249d29a20bd6bc3deac48/65eba3c5ad254c8316b1e09d_Croquette%201.png,1,,,"Filling[water, onion, boiled burdock, carrot, red bell pepper, concentrated soy protein, shiitake mushroom, chinese leek, cellophane noodles, soybean oil, modified corn starch, salt, black pepper, sauce(broth), chili pepper], Dough(wheat flour, water, whole egg, shortening, sugar, yeast, dough improver, sea salt, baking powder, yeast food), Bread crumbs, Soybean oil",0,₫,0.0,0,50,0,0.0
Kimchi Croquette,https://tljus.com/donuts/kimchi-croquette,tljus,donuts,https://cdn.prod.website-files.com/649249d29a20bd6bc3deac48/65eba3d3f8af0be3e8b8dbb7_Kimchi%20Croquette%201.png,1,,,"Filling[kimchi, onion, water, green bell pepper, cellophane noodles, spicy sauce, concentrated soy protein, bread crumb, rice wine, soy sauce, soybean oil, ginger, garlic, red pepper powder, sugar, sauce(broth), black pepper], Dough(wheat flour, water, whole egg, shortening, sugar, yeast, dough improver, cheese flavored syrup, sea salt, baking powder, yeast food), Bread crumb, Soybean oil, Parsley flakes",0,₫,0.0,0,50,0,0.0
Sweet Rice Donut,https://tljus.com/donuts/sweet-rice-donut,tljus,donuts,https://cdn.prod.website-files.com/649249d29a20bd6bc3deac48/65eba3e06018c60c5576d3ac_Sweet%20Rice%20Donut%201.png,1,,,"Glutinous rice flour, Red bean paste, Water, Wheat flour, Sugar, Corn syrup, Shortening, Baking powder, Sea salt, Baking soda, Corn oil",0,₫,0.0,0,50,0,0.0
Sesame Donut,https://tljus.com/donuts/sesame-donut,tljus,donuts,https://cdn.prod.website-files.com/649249d29a20bd6bc3deac48/649249d29a20bd6bc3deae20_Sesame%20Donut.jpg,1,,,"Bread dough[glutinous flour(tapioca starch), water, whole egg, shortening, wheat flour, black sesame, trehalose(starch), soy sauce, sea salt, gluten], Corn oil, Sugar",0,₫,0.0,0,50,0,0.0
Red Bean Donut,https://tljus.com/donuts/red-bean-donut,tljus,donuts,https://cdn.prod.website-files.com/649249d29a20bd6bc3deac48/65eba40232b2446f99806836_Redbean%20Donut%201.png,1,,,"Bread dough[red bean paste(red bean, sugar), wheat flour, water, whole egg, margarine, sugar, mixed skim milk powder, yeast, roasted soybean powder, dough improver, sea salt, dark brown sugar, skimmed milk powder, yeast food, yeast], Corn oil, Sugar",0,₫,0.0,0,50,0,0.0
Baguette,https://tljus.com/breads/baguette,tljus,breads,https://cdn.prod.website-files.com/649249d29a20bd6bc3deac48/65ce6ca92b077a8e884aebbe_24Feb_Baguette.jpg,1,,,,0,₫,0.0,0,50,0,0.0
Chocolate Dipped Belgium Waffle,https://tljus.com/breads/chocolate-dipped-belgium-waffle,tljus,breads,https://cdn.prod.website-files.com/649249d29a20bd6bc3deac48/65ce6c94f24816ea491f65c6_24Feb_Beligium%20Waffle.jpg,1,,,,0,₫,0.0,0,50,0,0.0
Salt & Butter Roll,https://tljus.com/breads/salt-butter-roll,tljus,breads,https://cdn.prod.website-files.com/649249d29a20bd6bc3deac48/6581ea2246961a68f07732b2_bread_36.png,1,,,,0,₫,0.0,0,50,0,0.0
Buttercream Bread,https://tljus.com/breads/buttercream-bread,tljus,breads,https://cdn.prod.website-files.com/6419b668828857182d1e7359/645068bb1560011534b8f210_Butter%20Cream%20Bread.webp,1,,,"Bread dough(wheat flour, water, margarine, whole egg,
sugar, mixed skim milk powder, yeast, whipping cream, sea
salt, bread improver, yeast, skimmed milk powder), Butter
cream, Egg wash(egg, water)Bread dough(wheat flour, water, margarine, whole egg,
sugar, mixed skim milk powder, yeast, whipping cream, sea
salt, bread improver, yeast, skimmed milk powder), Butter
cream, Egg wash(egg, water)",0,₫,0.0,0,50,0,0.0
